{
  "$schema": "/metadata/index-mapping-schema.json",
  "workClassReference": "ApprovalDecision",
  "class": "ApprovalDecision",
  "entityType": "ApprovalDecision",
  "jsonPath": "$",
  "table": "approval_decision_index",
  "mappings": [
    { "jsonPath": "$.status", "plainColumn": "status", "type": "VARCHAR(100)", "nullable": true },
    { "jsonPath": "$.reason", "plainColumn": "reason", "type": "VARCHAR(255)", "nullable": true }
  ]
}