{
  "$schema": "/metadata/index-mapping-schema.json",
  "workClassReference": "Meta",
  "class": "Meta",
  "entityType": "Meta",
  "jsonPath": "$",
  "table": "meta_index",
  "mappings": [
    {
      "jsonPath": "$.priority",
      "plainColumn": "priority",
      "type": "VARCHAR(50)",
      "nullable": true
    }
  ]
}